{
  "protocol_version": "runtime-v4-expert-action",
  "schema_digest": "393318bda8c3522c0ecbacc78b95471a9f4dc3f825169d2048f4c74a7b7f2929",
  "provenance": {"artifact": "sts2-protocol/runtime-v4-expert-action", "source": "schemas/runtime-v4-expert-action.schema.json", "generator": "hand-authored"},
  "profile": "expert-action",
  "correlation_id": "request-2", "instance_id": "instance-1", "session_id": "session-1", "lease_id": "lease-1", "lease_epoch": 1,
  "generation": 8, "state_id": "live:8", "operation_id": "potion-op-1", "kind": "action_response",
  "action": {"action_id": "potion:7:potion:fire:enemy:1", "action": {"kind": "use_potion", "potion_id": "potion:fire", "target_id": "enemy:1"}},
  "status": "settled",
  "observation": {"protocol_version": "runtime-v4-expert", "schema_digest": "0ee034d5da83f34e9fa0ba23038738d56ef8cfccb1c6e752af3ab63d212c8e42"},
  "transition": {"kind": "potion_use_settled", "before_generation": 7, "after_generation": 8, "potion_id": "potion:fire", "removed": true},
  "error_code": null
}
